{
  "schema_version": "1.0.0",
  "kind": "named_site_reference_capture_plan",
  "plan_id": "seogu_gwangju.g1.handoff_evidence.v1",
  "site_id": "seogu_gwangju",
  "capture_mode": "controlled_read_only_reference",
  "allowed_hosts": ["www.seogu.gwangju.kr"],
  "allowed_methods": ["GET"],
  "routine_ci": {"network_policy": "offline"},
  "security_boundary": {
    "post_allowed": false,
    "form_submission_allowed": false,
    "login_allowed": false,
    "payment_allowed": false,
    "identity_verification_allowed": false,
    "pii_entry_allowed": false,
    "personal_file_upload_allowed": false,
    "actual_site_mutation_allowed": false
  },
  "completion_policy": {
    "g1_completion_claim": false,
    "executed_ledger_required": true,
    "uncaptured_state_policy": "capture_required_exception"
  },
  "states": [
    {
      "state_id": "illegal_parking_report.default.desktop",
      "source_seed_url": "https://www.seogu.gwangju.kr/trafficminwon/",
      "viewport": {"width": 1440, "height": 900},
      "state": {"name": "default"},
      "required_artifacts": ["html_dom_content", "screenshot", "visible_region_inventory", "public_asset_provenance"],
      "freeze_at_capture": false,
      "capture_required": true,
      "notes": "Seo-gu official parking fine portal (주정차단속조회 민원시스템). NEGATIVE evidence for #1343 S2: exposes 과태료 조회/납부/의견진술 (fine administration), NOT a resident illegal-parking report intake. Bounded read-only GET capture for the generic EXTERNAL_OFFICIAL_HANDOFF local evidence route."
    },
    {
      "state_id": "streetlight_report_handoff.default.desktop",
      "source_seed_url": "https://www.seogu.gwangju.kr/menu.es?mid=a10306030100",
      "viewport": {"width": 1440, "height": 900},
      "state": {"name": "default"},
      "required_artifacts": ["html_dom_content", "screenshot", "visible_region_inventory", "public_asset_provenance"],
      "freeze_at_capture": false,
      "capture_required": true,
      "notes": "Seo-gu official disaster-report center (재난신고센터). For #1343 S7: safety area links to 안전신문고; no streetlight-specific intake endpoint/department established. Bounded read-only GET capture for the generic EXTERNAL_OFFICIAL_HANDOFF local evidence route."
    },
    {
      "state_id": "litter_report_handoff.default.desktop",
      "source_seed_url": "https://www.seogu.gwangju.kr/menu.es?mid=a10308010100",
      "viewport": {"width": 1440, "height": 900},
      "state": {"name": "default"},
      "required_artifacts": ["html_dom_content", "screenshot", "visible_region_inventory", "public_asset_provenance"],
      "freeze_at_capture": false,
      "capture_required": true,
      "notes": "Seo-gu official household-waste handling page (생활폐기물처리 요령). For #1343 S8: disposal/collection guidance, NOT a verified litter-report intake. Bounded read-only GET capture for the generic EXTERNAL_OFFICIAL_HANDOFF local evidence route."
    }
  ]
}
