{
  "schema_version": "1.0.0",
  "kind": "named_site_reference_capture_plan",
  "plan_id": "seogu_gwangju.g1.unmanned_kiosk.v1",
  "site_id": "seogu_gwangju",
  "capture_mode": "controlled_read_only_reference",
  "allowed_hosts": ["www.seogu.gwangju.kr"],
  "allowed_methods": ["GET"],
  "routine_ci": {
    "network_policy": "offline"
  },
  "security_boundary": {
    "post_allowed": false,
    "form_submission_allowed": false,
    "login_allowed": false,
    "payment_allowed": false,
    "identity_verification_allowed": false,
    "pii_entry_allowed": false,
    "personal_file_upload_allowed": false,
    "actual_site_mutation_allowed": false
  },
  "completion_policy": {
    "g1_completion_claim": false,
    "executed_ledger_required": true,
    "uncaptured_state_policy": "capture_required_exception"
  },
  "states": [
    {
      "state_id": "unmanned_kiosk.list.desktop",
      "source_seed_url": "https://www.seogu.gwangju.kr/menu.es?mid=a10201040000",
      "viewport": {
        "width": 1440,
        "height": 900
      },
      "state": {
        "name": "list"
      },
      "required_artifacts": [
        "html_dom_content",
        "screenshot",
        "visible_region_inventory",
        "public_asset_provenance"
      ],
      "freeze_at_capture": false,
      "capture_required": true,
      "notes": "Issue #1360 S6 Seo-gu official unmanned civil-document kiosk catalog. Page-1-only bounded read-only capture. Do not execute search, pagination, map/location actions, form submission, login, payment, identity verification, PII entry, or external arbitrary navigation."
    }
  ]
}
