{
  "schema_version": "1.0.0",
  "kind": "named_site_reference_capture_plan",
  "plan_id": "seogu_gwangju.g1.v1",
  "site_id": "seogu_gwangju",
  "capture_mode": "controlled_read_only_reference",
  "allowed_hosts": ["www.seogu.gwangju.kr"],
  "allowed_methods": ["GET"],
  "routine_ci": {"network_policy": "offline"},
  "security_boundary": {
    "post_allowed": false,
    "form_submission_allowed": false,
    "login_allowed": false,
    "payment_allowed": false,
    "identity_verification_allowed": false,
    "pii_entry_allowed": false,
    "personal_file_upload_allowed": false,
    "actual_site_mutation_allowed": false
  },
  "completion_policy": {
    "g1_completion_claim": false,
    "executed_ledger_required": true,
    "uncaptured_state_policy": "capture_required_exception"
  },
  "states": [
    {
      "state_id": "home.desktop.default",
      "source_seed_url": "https://www.seogu.gwangju.kr/",
      "viewport": {"width": 1440, "height": 900},
      "state": {"name": "default"},
      "required_artifacts": ["html_dom_content", "screenshot", "visible_region_inventory", "public_asset_provenance"],
      "freeze_at_capture": false,
      "capture_required": true
    },
    {
      "state_id": "home.mobile.default",
      "source_seed_url": "https://www.seogu.gwangju.kr/",
      "viewport": {"width": 390, "height": 844},
      "state": {"name": "default"},
      "required_artifacts": ["html_dom_content", "screenshot", "visible_region_inventory", "public_asset_provenance"],
      "freeze_at_capture": false,
      "capture_required": true
    },
    {
      "state_id": "home.desktop.gnb_open",
      "source_seed_url": "https://www.seogu.gwangju.kr/",
      "viewport": {"width": 1440, "height": 900},
      "state": {"name": "gnb_open"},
      "required_artifacts": ["html_dom_content", "screenshot", "visible_region_inventory", "public_asset_provenance"],
      "freeze_at_capture": false,
      "capture_required": true
    },
    {
      "state_id": "notice.list.desktop",
      "source_seed_url": "https://www.seogu.gwangju.kr/board.es?act=listC&bid=0034&gon=C&mid=a10801000000",
      "viewport": {"width": 1440, "height": 900},
      "state": {"name": "default"},
      "required_artifacts": ["html_dom_content", "screenshot", "visible_region_inventory", "public_asset_provenance"],
      "freeze_at_capture": false,
      "capture_required": true
    },
    {
      "state_id": "notice.detail.desktop",
      "source_seed_url": "https://www.seogu.gwangju.kr/board.es?act=viewC&bid=0034&list_no=143047&mid=a10801000000&nPage=1&tag=",
      "viewport": {"width": 1440, "height": 900},
      "state": {"name": "detail_with_attachment_state"},
      "required_artifacts": ["html_dom_content", "screenshot", "visible_region_inventory", "public_asset_provenance"],
      "freeze_at_capture": true,
      "capture_required": true,
      "notes": "Resolve and freeze a stable current public notice detail at execution time if this seed changes."
    },
    {
      "state_id": "gosi.list.desktop",
      "source_seed_url": "https://www.seogu.gwangju.kr/api/eminwon/gosiXmlList.es?mid=a10807010000",
      "viewport": {"width": 1440, "height": 900},
      "state": {"name": "default"},
      "required_artifacts": ["html_dom_content", "screenshot", "visible_region_inventory", "public_asset_provenance"],
      "freeze_at_capture": false,
      "capture_required": true
    },
    {
      "state_id": "gosi.detail.desktop",
      "source_seed_url": "https://www.seogu.gwangju.kr/api/eminwon/gosiXmlView.es?method=selectOfrNotAncmt&methodnm=selectOfrNotAncmtRegst&mid=a10807010000&not_ancmt_mgt_no=55667",
      "viewport": {"width": 1440, "height": 900},
      "state": {"name": "detail"},
      "required_artifacts": ["html_dom_content", "screenshot", "visible_region_inventory", "public_asset_provenance"],
      "freeze_at_capture": true,
      "capture_required": true,
      "notes": "Resolve and freeze a stable current public announcement detail at execution time if this seed changes."
    },
    {
      "state_id": "civil_form.list.desktop",
      "source_seed_url": "https://www.seogu.gwangju.kr/board.es?mid=a10201100000&bid=0014",
      "viewport": {"width": 1440, "height": 900},
      "state": {"name": "default"},
      "required_artifacts": ["html_dom_content", "screenshot", "visible_region_inventory", "public_asset_provenance"],
      "freeze_at_capture": false,
      "capture_required": true
    },
    {
      "state_id": "civil_form.detail.desktop",
      "source_seed_url": "https://www.seogu.gwangju.kr/board.es?act=view&bid=0014&list_no=140235&mid=a10201100000&nPage=1&tag=",
      "viewport": {"width": 1440, "height": 900},
      "state": {"name": "detail_with_download_state"},
      "required_artifacts": ["html_dom_content", "screenshot", "visible_region_inventory", "public_asset_provenance"],
      "freeze_at_capture": true,
      "capture_required": true,
      "notes": "Resolve and freeze a stable current public civil-form detail at execution time if this seed changes."
    },
    {
      "state_id": "organization.chart.desktop",
      "source_seed_url": "https://www.seogu.gwangju.kr/menu.es?mid=a10106030000",
      "viewport": {"width": 1440, "height": 900},
      "state": {"name": "default"},
      "required_artifacts": ["html_dom_content", "screenshot", "visible_region_inventory", "public_asset_provenance"],
      "freeze_at_capture": false,
      "capture_required": true
    },
    {
      "state_id": "staff.directory.desktop",
      "source_seed_url": "https://www.seogu.gwangju.kr/organization.es?mid=a10106040000",
      "viewport": {"width": 1440, "height": 900},
      "state": {"name": "default"},
      "required_artifacts": ["html_dom_content", "screenshot", "visible_region_inventory", "public_asset_provenance"],
      "freeze_at_capture": false,
      "capture_required": true
    }
  ]
}
